A1: 3 | B1: Basic Pathfinding
A2: =A1+1 -> 4 | B2: Advanced Pathfinding
A3: =A2+1 -> 5 | B3: Expert Pathfinding
A4: =A3+1 -> 6 | B4: Basic Archery
A5: =A4+1 -> 7 | B5: Advanced Archery
A6: =A5+1 -> 8 | B6: Expert Archery
A7: =A6+1 -> 9 | B7: Basic Logistics
A8: =A7+1 -> 10 | B8: Advanced Logistics
A9: =A8+1 -> 11 | B9: Expert Logistics
A10: =A9+1 -> 12 | B10: Basic Scouting
A11: =A10+1 -> 13 | B11: Advanced Scouting
A12: =A11+1 -> 14 | B12: Expert Scouting
A13: =A12+1 -> 15 | B13: Basic Diplomacy
A14: =A13+1 -> 16 | B14: Advanced Diplomacy
A15: =A14+1 -> 17 | B15: Expert Diplomacy
A16: =A15+1 -> 18 | B16: Basic Navigation
A17: =A16+1 -> 19 | B17: Advanced Navigation
A18: =A17+1 -> 20 | B18: Expert Navigation
A19: =A18+1 -> 21 | B19: Basic Leadership
A20: =A19+1 -> 22 | B20: Advanced Leadership
A21: =A20+1 -> 23 | B21: Expert Leadership
A22: =A21+1 -> 24 | B22: Basic Wisdom
A23: =A22+1 -> 25 | B23: Advanced Wisdom
A24: =A23+1 -> 26 | B24: Expert Wisdom
A25: =A24+1 -> 27 | B25: Basic Mysticism
A26: =A25+1 -> 28 | B26: Advanced Mysticism
A27: =A26+1 -> 29 | B27: Expert Mysticism
A28: =A27+1 -> 30 | B28: Basic Luck
A29: =A28+1 -> 31 | B29: Advanced Luck
A30: =A29+1 -> 32 | B30: Expert Luck
A31: =A30+1 -> 33 | B31: Basic Ballistics
A32: =A31+1 -> 34 | B32: Advanced Ballistics
A33: =A32+1 -> 35 | B33: Expert Ballistics
A34: =A33+1 -> 36 | B34: Basic Eagle Eye
A35: =A34+1 -> 37 | B35: Advanced Eagle Eye
A36: =A35+1 -> 38 | B36: Expert Eagle Eye
A37: =A36+1 -> 39 | B37: Basic Necromancy
A38: =A37+1 -> 40 | B38: Advanced Necromancy
A39: =A38+1 -> 41 | B39: Expert Necromancy
A40: =A39+1 -> 42 | B40: Basic Estates
A41: =A40+1 -> 43 | B41: Advanced Estates
A42: =A41+1 -> 44 | B42: Expert Estates
A43: =A42+1 -> 45 | B43: Basic Fire Magic
A44: =A43+1 -> 46 | B44: Advanced Fire Magic
A45: =A44+1 -> 47 | B45: Expert Fire Magic
A46: =A45+1 -> 48 | B46: Basic Air Magic
A47: =A46+1 -> 49 | B47: Advanced Air Magic
A48: =A47+1 -> 50 | B48: Expert Air Magic
A49: =A48+1 -> 51 | B49: Basic Water Magic
A50: =A49+1 -> 52 | B50: Advanced Water Magic
A51: =A50+1 -> 53 | B51: Expert Water Magic
A52: =A51+1 -> 54 | B52: Basic Earth Magic
A53: =A52+1 -> 55 | B53: Advanced Earth Magic
A54: =A53+1 -> 56 | B54: Expert Earth Magic
A55: =A54+1 -> 57 | B55: Basic Scholar
A56: =A55+1 -> 58 | B56: Advanced Scholar
A57: =A56+1 -> 59 | B57: Expert Scholar
A58: =A57+1 -> 60 | B58: Basic Tactics
A59: =A58+1 -> 61 | B59: Advanced Tactics
A60: =A59+1 -> 62 | B60: Expert Tactics
A61: =A60+1 -> 63 | B61: Basic Artillery
A62: =A61+1 -> 64 | B62: Advanced Artillery
A63: =A62+1 -> 65 | B63: Expert Artillery
A64: =A63+1 -> 66 | B64: Basic Learning
A65: =A64+1 -> 67 | B65: Advanced Learning
A66: =A65+1 -> 68 | B66: Expert Learning
A67: =A66+1 -> 69 | B67: Basic Offence
A68: =A67+1 -> 70 | B68: Advanced Offence
A69: =A68+1 -> 71 | B69: Expert Offence
A70: =A69+1 -> 72 | B70: Basic Armorer
A71: =A70+1 -> 73 | B71: Advanced Armorer
A72: =A71+1 -> 74 | B72: Expert Armorer
A73: =A72+1 -> 75 | B73: Basic Intelligence
A74: =A73+1 -> 76 | B74: Advanced Intelligence
A75: =A74+1 -> 77 | B75: Expert Intelligence
A76: =A75+1 -> 78 | B76: Basic Sorcery
A77: =A76+1 -> 79 | B77: Advanced Sorcery
A78: =A77+1 -> 80 | B78: Expert Sorcery
A79: =A78+1 -> 81 | B79: Basic Resistance
A80: =A79+1 -> 82 | B80: Advanced Resistance
A81: =A80+1 -> 83 | B81: Expert Resistance
A82: =A81+1 -> 84 | B82: Basic First Aid
A83: =A82+1 -> 85 | B83: Advanced First Aid
A84: =A83+1 -> 86 | B84: Expert First Aid